{
  "$schema": "https://json-schema.org/draft/2020-12/schema",
  "$id": "https://csvpath.org/schemas/csvpath-macie-wrapper-v1.json",
  "title": "CsvPath Macie wrapper, format version 1",
  "description": "Structure only. Cross-references (selected ids must have entries, selector vs resolved list, etc.) are checked in MacieWrapperLoader. See specs/macie/wrapper-format.md.",
  "type": "object",
  "required": ["csvpath_macie", "source", "selection", "managedDataIdentifiers"],
  "additionalProperties": false,
  "properties": {
    "csvpath_macie": { "const": 1 },
    "source": { "$ref": "#/$defs/source" },
    "selection": { "$ref": "#/$defs/selection" },
    "managedDataIdentifiers": { "$ref": "#/$defs/managedDataIdentifiers" },
    "customDataIdentifiers": {
      "type": "array",
      "items": { "$ref": "#/$defs/customDataIdentifier" }
    },
    "allowLists": {
      "type": "array",
      "items": { "$ref": "#/$defs/allowList" }
    },
    "findingsFilters": {
      "type": "array",
      "items": { "$ref": "#/$defs/findingsFilter" }
    },
    "aws": {
      "type": "object",
      "additionalProperties": false,
      "properties": {
        "classificationJob": { "type": "object" },
        "sensitivityInspectionTemplate": { "type": "object" }
      }
    },
    "warnings": {
      "type": "array",
      "items": { "$ref": "#/$defs/warning" }
    }
  },
  "$defs": {
    "nonEmptyString": { "type": "string", "minLength": 1 },
    "idList": {
      "type": "array",
      "items": { "$ref": "#/$defs/nonEmptyString" }
    },
    "source": {
      "type": "object",
      "required": ["origin"],
      "additionalProperties": false,
      "properties": {
        "origin": { "enum": ["job", "template", "handcrafted"] },
        "account_id": { "type": "string", "pattern": "^\\d{12}$" },
        "region": { "$ref": "#/$defs/nonEmptyString" },
        "downloaded_at": {
          "type": "string",
          "pattern": "^\\d{4}-\\d{2}-\\d{2}T\\d{2}:\\d{2}:\\d{2}(\\.\\d+)?Z$"
        },
        "job_id": { "$ref": "#/$defs/nonEmptyString" },
        "template_id": { "$ref": "#/$defs/nonEmptyString" }
      },
      "allOf": [
        {
          "if": { "properties": { "origin": { "const": "job" } } },
          "then": { "required": ["job_id", "account_id", "region", "downloaded_at"] }
        },
        {
          "if": { "properties": { "origin": { "const": "template" } } },
          "then": { "required": ["template_id", "account_id", "region", "downloaded_at"] }
        }
      ]
    },
    "selection": {
      "type": "object",
      "required": ["managedDataIdentifierSelector"],
      "additionalProperties": false,
      "properties": {
        "managedDataIdentifierSelector": {
          "enum": ["ALL", "EXCLUDE", "INCLUDE", "NONE", "RECOMMENDED"]
        },
        "managedDataIdentifierIds": { "$ref": "#/$defs/idList" },
        "excludedManagedDataIdentifierIds": { "$ref": "#/$defs/idList" },
        "customDataIdentifierIds": { "$ref": "#/$defs/idList" },
        "allowListIds": { "$ref": "#/$defs/idList" }
      }
    },
    "managedDataIdentifiers": {
      "type": "object",
      "required": ["resolved"],
      "additionalProperties": false,
      "properties": {
        "resolved": { "$ref": "#/$defs/idList" },
        "resolution": {
          "type": "object",
          "additionalProperties": false,
          "properties": {
            "method": { "enum": ["selector"] },
            "recommended_list": { "type": ["string", "null"] }
          }
        },
        "available": {
          "type": "array",
          "items": {
            "type": "object",
            "required": ["id"],
            "properties": {
              "id": { "$ref": "#/$defs/nonEmptyString" },
              "category": { "type": "string" }
            }
          }
        }
      }
    },
    "customDataIdentifier": {
      "description": "A verbatim GetCustomDataIdentifier response. Only the fields the transpiler needs are required; AWS may add others.",
      "type": "object",
      "required": ["id", "name", "regex"],
      "properties": {
        "id": { "$ref": "#/$defs/nonEmptyString" },
        "name": { "$ref": "#/$defs/nonEmptyString" },
        "regex": { "type": "string", "minLength": 1, "maxLength": 512 },
        "deleted": { "type": "boolean" },
        "keywords": {
          "type": "array",
          "maxItems": 50,
          "items": { "type": "string", "minLength": 3, "maxLength": 90 }
        },
        "ignoreWords": {
          "type": "array",
          "maxItems": 10,
          "items": { "type": "string", "minLength": 4, "maxLength": 90 }
        },
        "maximumMatchDistance": { "type": "integer", "minimum": 1, "maximum": 300 },
        "severityLevels": {
          "type": "array",
          "minItems": 1,
          "maxItems": 3,
          "items": {
            "type": "object",
            "required": ["occurrencesThreshold", "severity"],
            "properties": {
              "occurrencesThreshold": { "type": "integer", "minimum": 1 },
              "severity": { "enum": ["LOW", "MEDIUM", "HIGH"] }
            }
          }
        }
      }
    },
    "allowList": {
      "type": "object",
      "required": ["settings"],
      "additionalProperties": false,
      "properties": {
        "settings": {
          "description": "A verbatim GetAllowList response.",
          "type": "object",
          "required": ["id", "name", "criteria"],
          "properties": {
            "id": { "$ref": "#/$defs/nonEmptyString" },
            "name": { "$ref": "#/$defs/nonEmptyString" },
            "criteria": {
              "type": "object",
              "oneOf": [
                {
                  "required": ["regex"],
                  "not": { "required": ["s3WordsList"] },
                  "properties": { "regex": { "type": "string", "minLength": 1, "maxLength": 512 } }
                },
                {
                  "required": ["s3WordsList"],
                  "not": { "required": ["regex"] },
                  "properties": {
                    "s3WordsList": {
                      "type": "object",
                      "required": ["bucketName", "objectKey"],
                      "properties": {
                        "bucketName": { "$ref": "#/$defs/nonEmptyString" },
                        "objectKey": { "$ref": "#/$defs/nonEmptyString" }
                      }
                    }
                  }
                }
              ]
            }
          }
        },
        "contents": {
          "type": "object",
          "required": ["status", "entries"],
          "additionalProperties": false,
          "properties": {
            "status": { "enum": ["OK", "ACCESS_DENIED", "NOT_FOUND", "EMPTY", "ERROR"] },
            "entries": {
              "type": "array",
              "maxItems": 100000,
              "items": { "type": "string", "minLength": 1, "maxLength": 90 }
            },
            "sha256": { "type": ["string", "null"], "pattern": "^[0-9a-f]{64}$" },
            "error": { "type": ["string", "null"] }
          }
        }
      }
    },
    "findingsFilter": {
      "description": "A verbatim GetFindingsFilter response.",
      "type": "object",
      "required": ["name", "action", "findingCriteria"],
      "properties": {
        "name": { "$ref": "#/$defs/nonEmptyString" },
        "action": { "enum": ["ARCHIVE", "NOOP"] },
        "findingCriteria": { "type": "object" },
        "position": { "type": "integer" }
      }
    },
    "warning": {
      "type": "object",
      "required": ["code", "message"],
      "additionalProperties": false,
      "properties": {
        "code": {
          "enum": ["ALLOW_LIST_UNREADABLE", "MACIE_ALLOW_LIST_STATUS", "CDI_DELETED_BUT_SELECTED"]
        },
        "subject": { "type": "string" },
        "message": { "$ref": "#/$defs/nonEmptyString" }
      }
    }
  }
}
