{
  "csvpath_macie": 1,
  "source": {
    "origin": "job",
    "account_id": "123456789012",
    "region": "us-east-1",
    "downloaded_at": "2026-10-29T17:40:00Z",
    "job_id": "5d0c4a1e8b7f6e5d4c3b2a1f0e9d8c7b"
  },
  "selection": {
    "managedDataIdentifierSelector": "NONE",
    "managedDataIdentifierIds": [],
    "excludedManagedDataIdentifierIds": [],
    "customDataIdentifierIds": ["2a1b7e4c-5d3f-4e8a-9b0c-1d2e3f4a5b6c"],
    "allowListIds": ["t7r4a1i9n2i8n5g3a6c0ct"]
  },
  "managedDataIdentifiers": {
    "resolved": [],
    "resolution": { "method": "selector", "recommended_list": null },
    "available": [
      { "category": "FINANCIAL_INFORMATION", "id": "CREDIT_CARD_NUMBER" },
      { "category": "PERSONAL_INFORMATION", "id": "USA_SOCIAL_SECURITY_NUMBER" }
    ]
  },
  "customDataIdentifiers": [
    {
      "arn": "arn:aws:macie2:us-east-1:123456789012:custom-data-identifier/2a1b7e4c-5d3f-4e8a-9b0c-1d2e3f4a5b6c",
      "createdAt": "2026-03-02T15:20:11Z",
      "deleted": false,
      "description": "Acme employee IDs",
      "id": "2a1b7e4c-5d3f-4e8a-9b0c-1d2e3f4a5b6c",
      "ignoreWords": ["EMP-000000"],
      "keywords": ["employee id", "emp id"],
      "maximumMatchDistance": 50,
      "name": "EmployeeId",
      "regex": "EMP-\\d{6}",
      "severityLevels": [
        { "occurrencesThreshold": 1, "severity": "LOW" },
        { "occurrencesThreshold": 5, "severity": "MEDIUM" },
        { "occurrencesThreshold": 10, "severity": "HIGH" }
      ],
      "tags": {}
    }
  ],
  "allowLists": [
    {
      "settings": {
        "arn": "arn:aws:macie2:us-east-1:123456789012:allow-list/t7r4a1i9n2i8n5g3a6c0ct",
        "createdAt": "2026-04-10T12:00:00Z",
        "criteria": { "regex": "EMP-9\\d{5}" },
        "description": "EMP-9xxxxx are training accounts, not real employees",
        "id": "t7r4a1i9n2i8n5g3a6c0ct",
        "name": "training-accounts",
        "status": { "code": "OK" },
        "tags": {},
        "updatedAt": "2026-04-10T12:00:00Z"
      }
    }
  ],
  "findingsFilters": [],
  "aws": {
    "classificationJob": {
      "allowListIds": ["t7r4a1i9n2i8n5g3a6c0ct"],
      "createdAt": "2026-06-02T14:00:00Z",
      "customDataIdentifierIds": ["2a1b7e4c-5d3f-4e8a-9b0c-1d2e3f4a5b6c"],
      "description": "HR exports, custom identifiers only",
      "jobArn": "arn:aws:macie2:us-east-1:123456789012:classification-job/5d0c4a1e8b7f6e5d4c3b2a1f0e9d8c7b",
      "jobId": "5d0c4a1e8b7f6e5d4c3b2a1f0e9d8c7b",
      "jobStatus": "COMPLETE",
      "jobType": "ONE_TIME",
      "managedDataIdentifierSelector": "NONE",
      "name": "hr-employee-ids",
      "s3JobDefinition": {
        "bucketDefinitions": [ { "accountId": "123456789012", "buckets": ["acme-hr-exports"] } ]
      },
      "samplingPercentage": 100,
      "tags": {}
    }
  },
  "warnings": []
}
